{
  "schema_version": "1.0",
  "annotations_sha256": "560119c0ffc39c89f5b3351b9394d3f39efa4ca04cc0985a411a6fb2f2be4f45",
  "annotation_count": 920,
  "taxonomy_version": "1",
  "dataset_sha256": "e681ce4fa4bba983122edf90b4d1a60b9a753ad16f7a1c6f70e01c38bf388ee8",
  "generated_at": "2026-10-31T11:23:05Z"
}
